id,title,media-type,source,content,word-count,content-to-sample,published,kgw-watermarked,kthl-watermarked,non-watermarked,pp-kgw-first,pp-kthl-first,kgw-wm-pscore,kgw-wm-pp-pscore,kthl-wm-pscore,kthl-wm-pp-pscore
c5000c26-5ad0-482f-a0d1-9ef69538d56e,Cryptzone Addresses Changing Cybersecurity Threats,News,MoneyShow.com,"Cryptzone, a provider of dynamic, context-aware network, application and content security solutions, today announced its 'Let's Talk Cybersecurity Seminar Series' multi city tour, where the company's CSO, Leo Taddeo and former FBI agent in the Special Operations/Cyber Division and invited guests will discuss the changing landscape of cybersecurity, how cyberattacks have increased and evolved to include organized crime, technical hackers, hacktivists, terrorists and nation-states - penetrating crumbling perimeter defenses.  He'll take a close look at the evolution of network security and how companies like Google are changing how they address access, as well as how to combat threats from the outside and within. 

""Organizations are recognizing that they need to fundamentally re-architect their security infrastructure, and are eager to discuss with their peers and industry experts the best practices for doing so,"" said Kurt A. Mueffelmann, President and CEO of Cryptzone. ""With the addition of experts like Leo Taddeo, our new CSO and former FBI agent in the Special Operations/Cyber Division, Cryptzone is excited to provide thought-provoking dialogue to help solve the problems that exist today, and help enterprises plan for what's coming tomorrow."" 
   
Cryptzone's leadership team will travel to Boston (Sept. 10), Toronto (Sept. 16), Chicago (Sept. 17) and New York City (Oct. 1), Dallas (Oct. 20), Washington, DC (Oct. 22) and London (Nov. 13) to lead a day of security discussions in each city. Spaces are limited and RSVP is required https://www.cryptzone.com/lets-talk-security-seminar-series-2015 . 

Leo Taddeo, Chief Security Officer (CSO), Cryptzone and former Special Agent in Charge of the Special Operations/Cyber Division of the FBI's New York Office, will lead the discussions. His expertise and past experience speaking to audiences of all expert levels, including shows such as American Bankers Association Securities Association (ABASA) Board of Directors Meeting, International Conference on Cyber Security at Fordham and Association of Bioscience Financial Officers allows for him to draw upon a broad industry perspective to cyber security. 

Prior to joining Cryptzone, Taddeo led more than 400 agents and professional support staff in cyber investigations, surveillance operations, information technology support and crisis management for the FBI. He oversaw high profile cases, including Silk Road, Blackshades and JP Morgan. 

Cryptzone's solutions begin by protecting at the network level to determine access to applications and services and provide an additional layer of security to control what authorized users can and can't do with content. The portfolio includes AppGate(R) , a dynamic, context aware security gateway that prevents unauthorized access; HiSoftware Security Sheriff (R) an integrated classification, encryption and content protection solution for SharePoint(R), Office 365 and File Shares; Simple Encryption Platform TM, which secures data in email, removable storage, files and folders; and Compliance Sheriff TM, which provides content governance for public websites, intranets and extranets. 

About Cryptzone 
Cryptzone secures the enterprise with dynamic, context aware security solutions that protect critical services, applications and content from internal and external threats. For over a decade, enterprises have turned to Cryptzone to galvanize their Cloud and network security with responsive protection and access intelligence. More than 450 public sector and enterprise customers, including some of the leading names in technology, manufacturing and consumer products trust Cryptzone to keep their data and applications secure. For more information go to http://www.cryptzone.com or follow us @Cryptzone. 

Read the full story at http://www.prweb.com/releases/2015/09/prweb12941084.htm 
PRWeb.com",543,"Cryptzone, a provider of dynamic, context-aware network, application and content security solutions, today announced its 'Let's Talk Cybersecurity Seminar Series' multi city tour, where the company's CSO, Leo Taddeo and former FBI agent in the Special Operations/Cyber Division and invited guests will discuss the changing landscape of cybersecurity, how cyberattacks have increased and evolved to include organized crime, technical hackers, hacktivists, terrorists and nation-states - penetrating crumbling perimeter defenses. He'll take a close look at the evolution of network security and how companies like Google are changing how they address access, as well as how to combat threats from the",2015-09-03T12:17:37Z," new emerging global cypher age concept known by critics or participants... From this presentation he can move ahead on answering our most frequently spoke questions with understanding what needs attention for law teams across America while leveraging three key business partners simultaneously: Kaspersky Security Strategies CEO Daniel Teppers Founder Mike McElver CoS Manager PXR Systems Executive Martin Rothberg Group CMO Jody Wright Fellow Bryan Alpern Graduate Work
IWL Symposium Coverage September 15 Review(s): 565 & 707","Cryptzone, a provider of dynamic, context-aware network, application and content security solutions, today announced its 'Let's Talk Cybersecurity Seminar Series' multi city tour, where the company's CSO, Leo Taddeo and former FBI agent in the Special Operations/Cyber Division and invited guests will discuss the changing landscape of cybersecurity, how cyberattacks have increased and evolved to include organized crime, technical hackers, hacktivists, terrorists and nation-states - penetrating crumbling perimeter defenses. He'll take a close look at the evolution of network security and how companies like Google are changing how they address access, as well as how to combat threats from the new cyber industry. Add to the mix the U.S. government's growing penchant for special cell phones, notebook computers, volatile devices, intrusive electronic devices and insurance data generated when people visit potentially sensitive websites, and the attempts to create security controls against end users in the United States. More info to come... Learn Cybercities in America atHillary Clinton as Secretary of State election selfie, only"," outside who work for or operate within your organization – some with no formal role but working alongside other professionals too engaged inside that business around an issue; we talk about what their products offer such capabilities here on WIKI (the best ways organizations can stay secure online), why vendors value transparency so much when dealing effectively while also supporting our communities by helping us make decisions


","The presentation will provide an overview of the emerging global cyber age concept, which has been acknowledged by critics or participants.","The 'Let's Talk Cybersecurity Seminar Series' launched today at Cryptzone, featuring discussions and workshops with Leo Taddeo, a former FBI agent in the Special Operations/Cyber Division, and invited guests.",8.874194008099672e-66,0.042418872398285214,0.09090909090909091,0.36363636363636365
29efcc41-6d99-49e2-bd0c-e3a9842557bd,Konta wins longest women's match in US Open history,News,Melbourne Age,"As her second-round match against Garbine Muguruza on Thursday afternoon dragged toward sweat-soaked infinitum, Johanna Konta caught herself glancing at the courtside clock.

""I'm like, 'Oh, OK,'"" Konta recalled thinking. ""We've been here for a while.""

The longest women's match in US Open history consumed three hours, 23 minutes on court 17, where Konta, a 24-year-old Briton, nibbled on bananas. She recalled the teachings of Juan Coto, her mental coach. And she ultimately persevered through the conditions to oust ninth-seeded Muguruza, 7-6 (7-4), 6-7 (7-4), 6-2.

""I left everything out there,"" said Konta, ranked No.97 in the world.

The loss was another recent disappointment for Muguruza, who has won only one match in three tournaments since reaching the final at Wimbledon.

""I think I am very tough on myself sometimes,"" said Muguruza, who committed 59 unforced errors. ""It's hard when you lose. It's always been like this.""

Muguruza said she could sense early in the match that Konta believed in herself, perhaps for good reason. In June, at a tune-up for Wimbledon, Konta defeated Muguruza in three sets. Konta later had the misfortune of facing Maria Sharapova in the first round at Wimbledon (Sharapova won easily), but Konta's confidence was growing. She has not lost since.

Her latest victory improved her winning streak to 15, although she has not faced a ton of top-notch competition. Ahead of the Open, she won two second-tier tournaments in Canada, where just two of her 10 opponents ranked among the top 100. At the Open, she won three matches in qualifying before defeating Louisa Chirico in the first round of the main draw.

""Every opponent is a new opponent,"" Konta said when asked about her winning streak, noting that none of them care how many matches she has won.

She added, ""You know, I am going to lose sooner or later. I'm not invincible. I'm no Serena Williams.""

Against Muguruza, Konta survived plenty of stressful situations (15 games went to deuce) and some adversity at the end of the second set. Trailing in the tiebreaker, 5-3, Konta was serving when Muguruza's return was called long. The ruling was overturned after a successful challenge by Muguruza. But rather than have the two players replay the point, the chair umpire awarded it to Muguruza, saying that the original out call had been late enough that Konta - who had missed her next shot - should not have been impaired by it.

Konta was upset, but her protests were pointless. Muguruza quickly closed out the tiebreaker to send the match to a third set.

""Obviously, I had my own opinion of it,"" Konta said, ""but you're always going to have tense moments and tense times of the match.""

Given the circumstances and the heat, Konta could have folded like a souffle. Instead, she broke Muguruza's serve to start the third set and then broke her again to race out to a 4-0 lead, which proved insurmountable. After Muguruza's forehand sailed long on match point, Konta braced the top of her head with her hand, as if she were afraid she would float away.

""This is what we train for,"" said Konta, a baseliner who leans on her fitness. ""This is why we put the hours in that we do. This is not my first rodeo with a 3 1/2-hour match.""

The victory was, without question, the most significant of her career. In the third round, she is scheduled to face No. 18 Andrea Petkovic.

New York Times",580,"As her second-round match against Garbine Muguruza on Thursday afternoon dragged toward sweat-soaked infinitum, Johanna Konta caught herself glancing at the courtside clock. ""I'm like, 'Oh, OK,'"" Konta recalled thinking. ""We've been here for a while."" The longest women's match in US Open history consumed three hours, 23 minutes on court 17, where Konta, a 24-year-old Briton, nibbled on bananas. She recalled the teachings of Juan Coto, her mental coach. And she ultimately persevered through the conditions to oust ninth-seeded Muguruza, 7-6 (7-4), 6-7 (7-4), 6-2. ""I left everything out there,"" said Konta, ranked No.97 in the world. The loss",2015-09-04T00:12:01Z," reminded both other singles coaches not all were perfect or even better after an opening game that would stay pretty good despite Mancini trying hard and how ineffective Sanfield got much further as well—even being placed one step astogether behind defending great Sereno Williams' title triumph last month when seven men broke 10 apart by two shots during five set pieces late most notably Oj Kaiwa vs., first time this season which featured over 260 entrants four times too badly timed no doubt likely among some 5 million noncontact competitors more worried about what came between Wawakabe than with whatever could happen below it.' At 894 days Maria Paikampos told Time magazine, beating 12 Women All World 1s together have taken power from people taking issues witting tought early into 2017 was neither inevitable; either way I spent 20 pounds packing something really solid every year until those big fish rung upstairs … then eat cold sausage!"" Pacing matters headfirst
At around 9 PM EST EWS Club Championship started","As her second-round match against Garbine Muguruza on Thursday afternoon dragged toward sweat-soaked infinitum, Johanna Konta caught herself glancing at the courtside clock. ""I'm like, 'Oh, OK,'"" Konta recalled thinking. ""We've been here for a while."" The longest women's match in US Open history consumed three hours, 23 minutes on court 17, where Konta, a 24-year-old Briton, nibbled on bananas. She recalled the teachings of Juan Coto, her mental coach. And she ultimately persevered through the conditions to oust ninth-seeded Muguruza, 7-6 (7-4), 6-7 (7-4), 6-2. ""I left everything out there,"" said Konta, ranked No.97 in the world. The loss spooked Muguruza's major, who anxiously awaited Sunday's second round matchup against him. After years of adhering to me-and-men rules in league play, despite rules baffling Jones and klulu's dominance at first and second, Time Inc. moved coverage to the 147-foot court. Baseball began dictating the game lightly cell phones at around 10, but games"," is also bittersweet—the final round ended up losing 1–0 during one quarter and only briefly after returning from back surgery; other losses were eliminated by former champions Andy Murray vs Sergey Kovalev five years earlier or lost 5–1 over Steve Sizemore last month.
Bridgewater: A Beautiful World By Darryl Sharpton Photograph via Twitter/CNET HILLSBORO WILSON PLAYING FOR MEMBER BROADFIELD In his hometown of Lake Champlain, Ga., New York City native Bridget Johnson has created an unlikely portrait portraying just how beautiful some places might look as far east he traveled across America four decades ago… But before then he looked much less familiar... It was hard not all those days long gone when you didn't meet someone who would stand that tall without looking past their white sheeting but with brash presence enough even if they'd never had anyone else around them live near your home! Now comes no time until young David O'","Despite Mancini's efforts, the opening game was not flawless, and Sanfield struggled further after being placed one ahead of Serena Williams in the title race.","While her second-round match against Garbine Muguruza was drawing to a close, Johanna Konta looked back at the courtside clock and said, ""I'm not sure...that's even happened. We've been here before."" She also remembered the lessons of Juan Colombo, who played in three sets, seven set on court, and recounted how they came by eating bananas during the most intense third hour and 23 minutes on Court 17 in US Open history.",2.039687906330538e-130,0.000545417588062648,0.09090909090909091,0.9090909090909091
