id,title,media-type,source,content,word-count,content-to-sample,published,kgw-watermarked,kthl-watermarked,non-watermarked,pp-kgw-first,pp-kthl-first,kgw-wm-pscore,kgw-wm-pp-pscore,kthl-wm-pscore,kthl-wm-pp-pscore
e595d973-c06d-4e50-adcd-0dbb9c86ad5e,"MARVELL SHAREHOLDER ALERT BY FORMER LOUISIANA ATTORNEY GENERAL: Kahn Swick & Foti, LLC Reminds Investors With Losses in Excess of $100,000 of Lead Plaintiff Deadline in Class Action Lawsuit Against Ma",News,SearchBug,"NEW ORLEANS, Sept.  14, 2015  (GLOBE NEWSWIRE) -- Kahn Swick & Foti, LLC (""KSF"") and KSF partner, the former Attorney General of Louisiana, Charles C. Foti, Jr., remind investors that they have until November 10, 2015 to file lead plaintiff applications in a securities class action lawsuit against Marvell Technology Group Ltd. (NasdaqGS:MRVL) if they purchased the Company’s securities between November 20, 2014 and September 10, 2015, inclusive (the “Class Period”).  This action is pending in the United States District Court for the Southern District of New York. 


What You May Do 
    
If you purchased shares of Marvell and would like to discuss your legal rights and how this case might affect you and your right to recover for your economic loss, you may, without obligation or cost to you, call toll-free at 1-877-515-1850 or email KSF Managing Partner Lewis Kahn ( lewis.kahn@ksfcounsel.com ). If you wish to serve as a lead plaintiff in this class action, you must petition the Court by November 10, 2015 . 
 
About the Lawsuit 
 
Marvell and certain of its executives are charged with failing to disclose material information during the Class Period, violating federal securities laws.  
 
On September 11, 2015, Marvell announced its preliminary second-quarter of fiscal year 2016 results of a loss of $382.4 million, whereas analysts had predicted a profit of $11.9 million.  The Company further revealed that the audit committee of the board “is conducting an investigation of certain accounting and internal control matters,” including whether revenue was recognized earlier than it should have been and whether senior management “set an appropriate tone for an effective control environment.” 
 
On this news, the price of Marvell’s stock plummeted by over 16%. 
 
About Kahn Swick & Foti, LLC 
 
To learn more about KSF, whose partners include the Former Louisiana Attorney General, Charles C. Foti, Jr., and other lawyers with significant experience litigating complex securities class actions nationwide on behalf of both institutional and individual shareholders, you may visit www.ksfcounsel.com . 
 Contact:

Kahn Swick & Foti, LLC
Lewis Kahn, Managing Partner lewis.kahn@ksfcounsel.com 1-877-515-1850
206 Covington St.
Madisonville, LA 7",345,"NEW ORLEANS, Sept. 14, 2015 (GLOBE NEWSWIRE) -- Kahn Swick & Foti, LLC (""KSF"") and KSF partner, the former Attorney General of Louisiana, Charles C. Foti, Jr., remind investors that they have until November 10, 2015 to file lead plaintiff applications in a securities class action lawsuit against Marvell Technology Group Ltd. (NasdaqGS:MRVL) if they purchased the Company’s securities between November 20, 2014 and September 10, 2015, inclusive (the “Class Period”). This action is pending in the United States District Court for the Southern District of New York. What You May Do If you purchased shares of Marvell and would",2015-09-15T02:00:00Z," want other applicable filing options available within 25 days from when specified herein on average upon signing these prospectuses before October 6 thereafter by preordering them ahead at http://bitstore.natsailesolutionsonlineperry.network\or clicking ""register now"" then enter their rates below with respect
— $5 up or over 5%, which grants both all permitted standard charge ($40/ounce.) Please see our Open Brokers Terms Continue To Apply Interest will be paid each January following termination after December 31, 2013","NEW ORLEANS, Sept. 14, 2015 (GLOBE NEWSWIRE) -- Kahn Swick & Foti, LLC (""KSF"") and KSF partner, the former Attorney General of Louisiana, Charles C. Foti, Jr., remind investors that they have until November 10, 2015 to file lead plaintiff applications in a securities class action lawsuit against Marvell Technology Group Ltd. (NasdaqGS:MRVL) if they purchased the Company’s securities between November 20, 2014 and September 10, 2015, inclusive (the “Class Period”). This action is pending in the United States District Court for the Southern District of New York. What You May Do If you purchased shares of Marvell and would like to file support articles in this issue, choose E-mailing: marvellprivacy.org Are you in the United States? Answer ""yes"" to both “represented litigantsHillary Clinton as Secretary of State election selfie, only four days after a full-body selfie https://t.co/jS0n3ytSoFH — Peter Levine (@peterlip"," like comment on them here at www.marveltechnologycompanyjoint, please call 1-212.-735–8999 or visit http://www
","By pre-ordering the prospectuses at http://bitstore.natsailesolutionsonlineperry.network, you can choose from various filing options that are available within 25 days of the information mentioned here or by paying an average fee of $5 or more per transaction if not already registered.","Kahn Swick & Foti, LLC (""KSF"") and former Attorney General of Louisiana, Charles C. Fotigi Jr., have informed investors that they have until November 10, 2015, to file lead plaintiff applications in a securities class action lawsuit against Marvell Technology Group Ltd. (NasdaqGS:MRVL) if they purchased the Company's securities between November 20, 2014 and September 10, 2015.",2.238486153119348e-65,2.2694892846076683e-06,0.09090909090909091,0.6363636363636364
10a6b98d-5881-4ea1-8f62-4ffdf13b5a3b,The Latest: RG III inactive as Washington's 3rd quarterback,News,Mail.com,"12:17 p.m. Philip Rivers hits the field to warm up in perfect conditions as he tries to extend his San Diego-record completion streak. He completed his last 20 passes in an opening win over Detroit, a club record that's four shy of Donovan McNabb's NFL record from 2004. 

It's sunny, 69 degrees and breezy for a game against the Bengals. Those with streaks longer than Rivers are: Peyton Manning, 23; Joe Montana, Mark Brunell, David Carr and Matt Ryan, 22 completions. __ Joe Kay reporting from Cincinnati 

12:10 p.m. 

Redskins quarterback Robert Griffin III was inactive, just like last week, but the difference is that he was coming off a concussion for the opener, while he's healthy enough to play against the Rams. 

He lost his starting job to Kirk Cousins during the preseason; now he is down to No. 3 on the depth chart, behind backup Colt McCoy. 

Rams rookie running back Todd Gurley, coming off left knee surgery, practiced this week and was thought to have a chance to make his NFL debut on Sunday, but he was inactive. 

—Howard Fendrich reporting from Washington 

11:55 a.m 

Wide receiver Dwayne Bowe will make his Cleveland Browns debut against the Titans. 

Bowe, who missed last week's game with a hamstring injury, should be one of the top targets for Johnny Manziel. 

Cleveland signed Bowe, formerly in Kansas City, to a 2-year, $12.5 million contract — $9 million guaranteed — in the offseason. 

—Tom Withers reporting from Cleveland 

11:50 a.m. 

Bills running back LeSean McCoy will play against the New England Patriots despite aggravating an injury to left hamstring in practice this week. 

McCoy had been listed as questionable. He's been bothered by the injury and missed the Bills final three preseason games after being hurt during a joint practice with the Cleveland Browns on Aug. 18. McCoy complained of being rusty after managing just 41 yards on 17 carries in Buffalo's 27-14 season-opening win over Indianapolis last week. He also had three catches for 46 yards. 

The Bills still managed a combined 147 yards rushing against Indianapolis — Buffalo's best total since gaining 193 at Chicago in last year's season opener. 

—John Wawrow reporting from Orchard Park, New York 

AP NFL website: www.pro32.ap.org and www.twitter.com/AP_NFL",375,"12:17 p.m. Philip Rivers hits the field to warm up in perfect conditions as he tries to extend his San Diego-record completion streak. He completed his last 20 passes in an opening win over Detroit, a club record that's four shy of Donovan McNabb's NFL record from 2004. It's sunny, 69 degrees and breezy for a game against the Bengals. Those with streaks longer than Rivers are: Peyton Manning, 23; Joe Montana, Mark Brunell, David Carr and Matt Ryan, 22 completions. __ Joe Kay reporting from Cincinnati 12:10 p.m. Redskins quarterback Robert Griffin III was inactive, just like last week,",2015-09-20T16:27:00Z," not training camp before this season started on Monday at Lamiami Terraclops Park near downtown Miami due south Sunday because of various technical restrictions during preparing drills. ""I haven�t done anything,"" rushed back out alongside Denver backup right tackle Jared Allen yesterday after sitting one entire preseason so day is now extended less intensively among other reasons (see also James Johnson or Karl Anderson!)

Lance Bouche says New England Patriots offensive coordinator Greg Kraft would never be upset if it were possible - regardless whether Belichick deems Russell all time leaders these numbers... Brandon Bolden has 14 career touchdowns passing touchdown games every year compared 1 run based yardage fantasy ranking by league experts

","12:17 p.m. Philip Rivers hits the field to warm up in perfect conditions as he tries to extend his San Diego-record completion streak. He completed his last 20 passes in an opening win over Detroit, a club record that's four shy of Donovan McNabb's NFL record from 2004. It's sunny, 69 degrees and breezy for a game against the Bengals. Those with streaks longer than Rivers are: Peyton Manning, 23; Joe Montana, Mark Brunell, David Carr and Matt Ryan, 22 completions. __ Joe Kay reporting from Cincinnati 12:10 p.m. Redskins quarterback Robert Griffin III was inactive, just like last week, after he was hit with a concussion from the Detroit Lions' scheme. ""He's broken a bone in his skull,"" Griffin said with a laugh. Stream video captures video from the game Monday night. Development Projection

Wide Receivers/6.5 Weight -57

11.58 1st - 6.0 2nd - 0.40 3rd - -2.00 4"," while running back Chris Thompson sat out Sunday after sitting off on injured reserve early Saturday night before returning when not needed ahead 15 minutes into Monday Night Football practice at Washington DC.'s most recent day started right around 6 or 7 PORP,' wrote reporter Jonathan Schechtel here Tuesday afternoon. ""We'll watch it all go down."" This is Cousins playing under pressure — but this won't be great action either…
Posted by Andy Krasinski @Kroswag","Due to technical restrictions during preparing drills, the season began on Monday at Lamiami Terraclops Park near downtown Miami. Lance Bouche believes that this is due to several factors, including being sidelined for injuries and other reasons.","Philip Rivers attempts to extend his San Diego-record completion streak with a warm welcome on the field at 12:17 p.m. Peyton Manning, Joe Montana, Mark Brunell, David Carr, and Matt Ryan all completed their last 20 passes in an opening victory over Detroit, setting 'a club record that's four shy of Donovan McNabb'S NFL record from 2004.",6.367249444096688e-84,1.1026093295536731e-06,0.09090909090909091,0.18181818181818182
cfabb78f-74ee-4c4f-a068-a64d2cb56b48,"Accident takes former Lycoming fullback's leg, but not love of football",Blog,Pennsylvania Sports,"WILLIAMSPORT - Mike Kapinus uses the word amazing when he talks about his son Tyler and so does Lycoming College football coach Mike Clark.     Kapinus, a senior, was projected by Clark to be the Warriors starting fullback this fall. That all changed on May 11 when Kapinus and his father, who owns K.A.P. Excavating in Eynon, were working in a Luzerne County cemetery. They were having trouble with the transmission on a small dump truck. Mike Kapinus was under the truck when it started to move. His son grabbed onto the passenger-side mirror and slowed it enough so, his father said, ""I was able to get out of harm's way. He saved my life."" Mike Kapinus suffered head injuries and a broken arm. His son was not as fortunate. When the truck hit a tree and spun around, a front wheel pinned him against the tree. His right leg was so badly injured it had to be amputated. While that ended his playing career, it has not stopped Kapinus from being part of the Lycoming football team. He received a prosthetic leg Aug. 10, and within days was out on the practice field with the aid of a cane as a student assistant coach. ""He loves Lycoming,"" his father said. ""This program means a lot me,"" Kapinus said in explaining why he came back. With friends on the team and the coaches, ""I couldn't imagine not being here."" The 21-year-old business management major with a minor in corporate communications works mainly with fullbacks, especially the younger kids, by giving them pointers. ""They've learned a lot,"" he said. ""He's a great resource for the fullbacks,"" Clark said. He helps with drills and ""more importantly sees the fullbacks while I'm watching the tailbacks. It is another set of eyes."" He uses his knowledge of the Warriors offense to correct the fullbacks or reinforce what they are doing is right, the coach said. Kapinus is on sidelines during games, working with Clark to make running back adjustments between offensive series. ""He made up his mind he was coming back,"" Clark said. ""I just marvel at his attitude every day. ""A lot of people in situations not nearly as challenging as this don't handle it anywhere close as he is handling it. It's amazing."" It was his goal was to get back to school and back to the football team, his father said. ""He's a hard worker,"" he said. ""He is just a good kid. He's always polite. He was a good team player."" Although he saw action in 15 games for Lycoming the past two years, Kapinus never carried the ball. The Warriors use fullbacks primarily as blocking backs.       Bouncing back from the devastating injury does not surprise his father. ""He's never been negative,"" he said. Kapinus was a member of the 2011 District 2 championship Valley View football team, where he played fullback and linebacker. He averaged about 7 yards a carry. He was first team all-Lackawanna League fullback and a second-team linebacker. Despite weighing 200 pounds, he also ran track. His father said he used to tell him when comparing him with runners 40 pounds lighter ""you're the fastest truck."" Kapinus also won awards for weightlifting in high school and said he continues to lift. Since fitted with the artificial leg he has gotten his driver's license and his pickup truck has a left-foot gas pedal.",565,"WILLIAMSPORT - Mike Kapinus uses the word amazing when he talks about his son Tyler and so does Lycoming College football coach Mike Clark. Kapinus, a senior, was projected by Clark to be the Warriors starting fullback this fall. That all changed on May 11 when Kapinus and his father, who owns K.A.P. Excavating in Eynon, were working in a Luzerne County cemetery. They were having trouble with the transmission on a small dump truck. Mike Kapinus was under the truck when it started to move. His son grabbed onto the passenger-side mirror and slowed it enough so, his father",2015-09-15T14:15:45Z,"'s attention did drench Lucille Kilgus' brow as well (and sent down shock waves of destruction upon Kyrie Cyprien). He missed what had already struck Alex Gordon like an overwhelming lightning strike; Blake Bannum snarlings ""Fuck my dear Daddy!"" while Matt Holliday yells from behind them for Michael Faried rushed six yards overboard before huddling — along every bar plate that hung out where Kevond Robinson runs our section: I put up those big eyes because FADIE didn't come back easy...","WILLIAMSPORT - Mike Kapinus uses the word amazing when he talks about his son Tyler and so does Lycoming College football coach Mike Clark. Kapinus, a senior, was projected by Clark to be the Warriors starting fullback this fall. That all changed on May 11 when Kapinus and his father, who owns K.A.P. Excavating in Eynon, were working in a Luzerne County cemetery. They were having trouble with the transmission on a small dump truck. Mike Kapinus was under the truck when it started to move. His son grabbed onto the passenger-side mirror and slowed it enough so, his father, who is a junior, could see it blink. He then hauled his son out seconds later to me- ""Oh, it just started to circle!"" giggled Luke Jones. It was called when the staffer did this picture about Time Inc. John Mearls stopped for better intelligence. He looked Davey like he was cell phones addicted. He must've been talking late. They drove to some"," had no choice but turn over or pick up where they left off ""in case you need help."" The car got stuck again at 7 p... more",The attention of the crew caused a stir in Lucille Kilgus' eyebrow and resulted in shock waves hitting Kyrie Cyprien.,"Mike Kapinus, a senior, was expected to be the starting fullback for the Warriors this fall, but things took nimble when he and his father, who owns K.A.P. Excavating in Eynon, were working on repairing the transmission on an abandoned dump truck at 3:30 pm while visiting Tyler, their son.",5.9239815969716775e-67,0.0027366017862441435,0.09090909090909091,0.7272727272727273
