id,title,media-type,source,content,word-count,content-to-sample,published,kgw-watermarked,kthl-watermarked,non-watermarked,pp-kgw-first,pp-kthl-first,kgw-wm-pscore,kgw-wm-pp-pscore,kthl-wm-pscore,kthl-wm-pp-pscore
1ac81e93-03a3-4ab5-8181-95732822cb4c,"Nebraska avoids another heartbreak, survives late scare against Southern Miss",News,ESPN.com,"Southern Miss nearly flipped the script on Nebraska. 

One week after storming back from 23 points down the fourth quarter to force overtime in a loss at Miami, the Huskers surrendered three late touchdowns in less than seven minutes, holding on for a 36-28 win Saturday over the Golden Eagles at Memorial Stadium. 

Nebraska (2-2) jumped to a 22-0 halftime lead on five field goals by Drew Brown and a defensive effort that held Southern Miss to minus-14 rushing yards in the opening two quarters. But Nick Mullens threw for for 331 yards in the second half, finishing with 447 against a maligned Nebraska secondary to keep the outcome in doubt until the final second. 

After Brown missed a 24-yard field goal with 29 seconds to play, Mullens hit Casey Martin for gains of 19 and 21 yards to reach the Nebraska 40-yard line. Defensive end Freedom Akinmoladun then sacked Mullens. The clock expired before Southern Miss could attempt a Hail Mary. 

What the win means for Nebraska: More stress. The Huskers escaped against an inferior opponent, getting 368 yards on 23-of-35 passing from Tommy Armstrong Jr. On one hand, the Huskers aren’t far from 4-0, losing on the final play against BYU and Miami. Conversely, Nebraska enters Big Ten play next week at Illinois with a secondary in something close to disarray, threatening to derail progress made in other areas under first-year coach Mike Riley. 

What the loss means for Southern Miss: The Golden Eagles failed to duplicate their 2004 victory in Lincoln, but the effort in coming back confirms the continued progress under third-year coach Todd Monken. Southern Miss enters play in Conference USA at 2-2 with competitive showings against Nebraska and Mississippi State to buoy confidence. 

Unsung hero: Nebraska fullback Andy Janovich rushed five times for 68 yards and caught one pass for 53. Prior to Saturday, the senior from Gretna, Nebraska, had rushed three times in his career for 6 yards. Janovich, a special teams star, did everything Saturday but score. Actually, he did reach the end zone on a 15-yard run in the fourth quarter, but it was called back for a holding penalty on receiver Alonzo Moore. The Huskers need a physical presence in their run game. And while Janovich likely won’t get as much work as Saturday on a regular basis, he adds an nice element to the offense. 

Uh, what? Nebraska cornerback Joshua Kalu was flagged for pass interference on fourth-and-13 throw by Mullens to Martin with seven minutes to play in the fourth quarter. The Golden Eagles got a nice acting performance from Martin, who flopped to the ground after minimal contact as Kalu intercepted the pass near the goal line. Kalu was also flagged for a personal foul after he spiked the football, giving Southern Miss a first down at the 1. It scored on the next play, cutting Nebraska’s lead to the final margin of eight points.",488,"Southern Miss nearly flipped the script on Nebraska. One week after storming back from 23 points down the fourth quarter to force overtime in a loss at Miami, the Huskers surrendered three late touchdowns in less than seven minutes, holding on for a 36-28 win Saturday over the Golden Eagles at Memorial Stadium. Nebraska (2-2) jumped to a 22-0 halftime lead on five field goals by Drew Brown and a defensive effort that held Southern Miss to minus-14 rushing yards in the opening two quarters. But Nick Mullens threw for for 331 yards in the second half, finishing with 447",2015-09-26T20:35:17Z," as well going 76 seconds without touchdown catches while averaging 87 touch steps every season entering 2016:.239 40 yard total game (.303 3rd time this school hadn'' t had them up 300 consecutive). In February UConn showed signs it could be sustainable again there when turning 24 just 48 snaps deep, reaching 200 receiving allowed through its third scrimmage twice earlier against UNLV last month : 71 target range - 54 dropbacks — 2 pass interference runs included Sunday All of which are coming within 90 feet...Miss Southin's passing defense extends even further so no team seems outmatched The line has cooled around players like Tennessee wide Receiver Mike Collins who started 16 Games As or Her Expected With More Football Out…New Hampshire vs North Central Michigan Posted 10/27 Shaken Up Man Pity On Senior WR
Q1_QB James Klin He was strong all day but did miss games during breaks despite continuing his productive playing schedule.....Jalelee Gee Okah State Coach Joe Mixon   Not ideal","Southern Miss nearly flipped the script on Nebraska. One week after storming back from 23 points down the fourth quarter to force overtime in a loss at Miami, the Huskers surrendered three late touchdowns in less than seven minutes, holding on for a 36-28 win Saturday over the Golden Eagles at Memorial Stadium. Nebraska (2-2) jumped to a 22-0 halftime lead on five field goals by Drew Brown and a defensive effort that held Southern Miss to minus-14 rushing yards in the opening two quarters. But Nick Mullens threw for for 331 yards in the second half, finishing with 447 yards, no touchdowns or turnovers. Student-athlete Benedict Duff, in his first-year dorm, notched a 51-yard score to end the game. The win extended the Huskers' lead at 84-79 heading into Monday's 147-10 rout. Nebraska's Dave Bernstein could have scored cell phones at least 10,000 miles away late in the game. Any other kind of torture"," passing against Iowa State's 11 pass attempts early during their 18 straight wins as it took them 19 of 31 overall going 25 -17 rather quickly.""We're just trying our best,"" said Big Sky coach Mike MacIntyre about starting quarterback Jay Ashurst who started 3:06 but sat out most Sunday due injuries suffered earlier this month prior coming off an ACL tear he sustained Sept 10th & playing only 13 snaps last year or so leading Louisiana Tech ahead before his sophomore season ended prematurely
Posted 6/6 | First Quarter","Despite an average of 87 touch steps per season, UConn had a disappointing year with only 24 receiving snaps and reaching 200 receiving allowed in its third scrimmage.","After conceding three late touchdowns in under seven minutes, Southern Miss nearly reversed the trend and won a 36-28 victory over the Golden Eagles at Memorial Stadium.",1.350332169137279e-123,0.010197420091687953,0.09090909090909091,0.45454545454545453
c267602c-bd9c-4461-b133-f598f070429a,"Report: Barring setback, Dolphins LT Albert to be ready for Week 1",News,DailyNews724.com,"Miami Dolphins left tackle Branden Albert is coming off of a torn ACL suffered last season, which has left the team with a big question mark on the left side of the offensive line all offseason. 

Fortunately, it sounds like Albert will be ready to go in Week 1. According to Armando Salguero of the Miami Herald, that's the plan for Albert, so long as there's no major setback. 

Albert's timetable has been pegged as anywhere from Week 1 to Week 3, but it sounds like the regular season opener is the plan as of now. That is a big boost for a struggling offensive line in Miami that has question marks everywhere. Albert will start alongside Dallas Thomas, Jamil Douglas, Mike Pouncey, and likely Ja'Waun James on the offensive line. 

Ryan Tannehill has found himself on his back far too often in the past two seasons, having been sacked 104 times in that time period. Barring a setback, Tannehill's blindside should be protected in Week 1. 

(h/t Armando Salguero)",170,"Miami Dolphins left tackle Branden Albert is coming off of a torn ACL suffered last season, which has left the team with a big question mark on the left side of the offensive line all offseason. Fortunately, it sounds like Albert will be ready to go in Week 1. According to Armando Salguero of the Miami Herald, that's the plan for Albert, so long as there's no major setback. Albert's timetable has been pegged as anywhere from Week 1 to Week 3, but it sounds like the regular season opener is the plan as of now. That is a big",2015-09-01T19:15:28Z," surprise considering he was signed through 2020 at age 50
 It may also sound strange how quickly rookies settle onto new stars starting out after being taken care I mean DeShaun Howard went 15 yards down and put up 104 total QB attempts over five games (and showed great aggressor) today while Sammie Coates sputtered nicely across this month. …It would help if we can start seeing better production into junior Ben Garland though because Gahoue Morris clearly never managed your typical run blocking upside even before his pro experience commenced two year…

Trevante Savage got done getting an especially average pass rush by running away clean right? He wasn'nt healthy going 5 against Denver twice -- plus you have Sean Taylor giving Chris Borland almost nothing under 40 yardage vs RT7 pic just FYD: Ht-back 2 Andre Roberts 7 6 4? $869 The Titans were looking pretty good without Brent Celek hurt – another problem they need dealt soon here where other OLBs play beyond","Miami Dolphins left tackle Branden Albert is coming off of a torn ACL suffered last season, which has left the team with a big question mark on the left side of the offensive line all offseason. Fortunately, it sounds like Albert will be ready to go in Week 1. According to Armando Salguero of the Miami Herald, that's the plan for Albert, so long as there's no major setback. Albert's timetable has been pegged as anywhere from Week 1 to Week 3, but it sounds like the regular season opener is the plan as of now. That is a big knock for Albert's contract, as Salguero said Michael Crabtree will play only one snap largely because of Albert's absence. Should Albert join out for the game, Safaiis said he expects Utah defensive Line Coach Kaleb Herron will be used. Then there's Raiders coach Gene Smith, who has also been a big deal in training camp, going so far as to say that Albert is"," step up after how he went through surgery earlier this month and didn't show enough improvement at quarterback over his first nine games (with seven rushing touchdowns compared thereto).
- - -- Andrew Kirell (@AndrewK_1) March 12th 2015","Given that he was signed through 2020 at age 50, it may seem unexpected that rookies can easily adapt to their new signings after being taken care of. For instance, DeShaun Howard impressed and scored 104 QB attempts over five games, while Sammie Coates struggled strongly this month. Additionally, Gahoue Morris demonstrated never-recognized run blocking upside before his professional experience began two years ago.","Despite facing significant challenges, Miami Dolphins left tackle Branden Albert is expected to return to his normal game in Week 1, as reported by Armando Salguero of the Miami Herald. The team has been counting down the days from Week 1 to Week 3, but it appears that he will be ready to go next week without any major setbacks.",2.312186707838106e-114,1.6792591646642742e-06,0.09090909090909091,0.6363636363636364
7ddfde85-8c3c-4fe1-8f81-370436c79964,"Mayor of Barcelona:  We want cities that are committed to human rights and to life, cities of which we can be proud",Blog,BONGORAMA.COM,"[caption id=""attachment_9645"" align=""alignnone"" width=""660""] Barcelona (España), 04 de noviembre 2013. El Canciller Ricardo Patiño ofreció una rueda de prensa junto a Ada Colau, activista social y una de las fundadoras de la Plataforma de Afectados por la Hipoteca. Foto: Fernanda LeMarie - Cancillería del Ecuador.[/caption]

By Ada Colau Ballano, mayor of Barcelona, Spain


The day before yesterday 50 people died by suffocation in the hold of a ship. Yesterday more than 70 people were found dead inside a lorry. Today we wake up with two shipwrecks: perhaps more than a hundred dead. We have a sea full of dead people. Borders full of wires, spikes, blades… and dead people.

Men, women, boys and girls, dead.

And a part of Europe weeps, cries out, a part wishes them to be saved, to not die but… but does not want them to come over. They should go away, they should disappear, they shouldn’t exist and we shouldn’t have to see them on TV, let alone on our streets, with their blankets, in the subway or on the steps of our homes.

Some irresponsibly promote fear of “the other”, “the illegal”, “those who come to sell without a permit”, “to use our healthcare”, “to take our school places”, “to scrounge”, “to beg”, “to commit crime”…

But fear is just that: fear. Our fear to live in a bit worse conditions against their fear to not be able to survive. Our fear of having to share a small part of our welfare against their fear of hunger and death, which is so acute that it gave them the strength to risk it all in order to come over without any baggage other than their own fear.

Fear against fear. And theirs is stronger. So, Europe, Europeans: open your eyes. There will not be enough walls and wires nor teargas nor rubber bullets to stop this. We either approach a human tragedy starting from our ability to love that makes us human or we are all going to end up dehumanized. And there will be more deaths, many more. This is not a struggle to protect us from “the others”. Right now it is a war against life.

Governments have to stop threatening with the “call effect”. What Europe urgently needs is an “affect call”, a call for empathy. They could be our children, our sisters or mothers. It could be us, just like many of our grandparents were forced into exile.

Even though it is a matter of State and European competence, from Barcelona we will do all we can to participate in a network of refugee-cities. We want cities that are committed to human rights and to life, cities of which we can be proud.

[Source]",453,"[caption id=""attachment_9645"" align=""alignnone"" width=""660""] Barcelona (España), 04 de noviembre 2013. El Canciller Ricardo Patiño ofreció una rueda de prensa junto a Ada Colau, activista social y una de las fundadoras de la Plataforma de Afectados por la Hipoteca. Foto: Fernanda LeMarie - Cancillería del Ecuador.[/caption] By Ada Colau Ballano, mayor of Barcelona, Spain The day before yesterday 50 people died by suffocation in the hold of a ship. Yesterday more than 70 people were found dead inside a lorry. Today we wake up with two shipwrecks: perhaps more than a hundred dead. We have a sea full of dead people.",2015-09-03T03:51:26Z, No explanation was given just cause that this might make us ill and sick until soon on coming to terms also too late for treatment due early next week when they'll all wait till here quite so severely or at most shortly ago after giving special attention especially if it's during sleep deprivation which I am under care not bad as long can keep you out from accident but my lungs are getting back really hard these morning few sure times he gave one nods his blessing always able him good will...,"[caption id=""attachment_9645"" align=""alignnone"" width=""660""] Barcelona (España), 04 de noviembre 2013. El Canciller Ricardo Patiño ofreció una rueda de prensa junto a Ada Colau, activista social y una de las fundadoras de la Plataforma de Afectados por la Hipoteca. Foto: Fernanda LeMarie - Cancillería del Ecuador.[/caption] By Ada Colau Ballano, mayor of Barcelona, Spain The day before yesterday 50 people died by suffocation in the hold of a ship. Yesterday more than 70 people were found dead inside a lorry. Today we wake up with two shipwrecks: perhaps more than a hundred dead. We have a sea full of dead people. What happens when you know people have died? You know that, everyday. We see at least 2 died outside homes just two days ago. Then there was a Caracas ambulance death on the outskirts of a family for no other reason than this is for personal reasons. There are few changes, I guess 14 people were killed, but it will never be that high. We have major regeneration projects on a"," Only 5% are from Puerto Ricans alone and I don't see many other countries getting sick or dying just because they say that these things do not exist [citation needed]. It is my intention to start thinking about how best using resources can be used for this one purpose as well.... [...] Catalonia will live longer. In fact it has been living long enough : there doesn´t need any extra work either except on those who own cars right now.... There did what you should always carry something but today all transport needs would get cheaper too where possible...
Tranquilayo-Rodríguez August 18 – October 1, 2014...

 'Ardibilia se poco' [""All our food goes back into Central Bank treasury""], Trian Quiliaguros ""Oleg Silvas"", Madrid February 24th 2012  at last post #1000003 http://www2u01e03mvccp4s9y0x6de14k",There was no justification given that it could make us sick until too late.,"In Barcelona, Spain, on November 04, 2013, El Canciller Ricardo Patia was photographed with a street in front of the Mayor Felipe de Colau.",3.768947332537898e-60,0.06141132405069629,0.09090909090909091,0.9090909090909091
6d8f4d6c-d7a4-4df0-96d5-cb2a3c61a0b8,"GRCC In the News, 9-15-15",Blog,What's on @ GRCC,"Discover Manufacturing symposium addresses talent shortage

Sept. 14, 2015; Grand Rapids Business Journal

A regional manufacturing industry consortium is highlighting best practices and opportunities for businesses when it comes to addressing the talent shortage at an event this week.

... Presenters include: John Buchan, Autocam; Lyzenga, West Michigan Works!; Julie Parks, Grand Rapids Community College, on the Michigan Coalition for Advanced Manufacturing; Laura Elsner, DeWys Manufacturing, on DeWys University; Jean Arteaga, Coopersville High School; and Maureen Lynch, Flexco.

Aquinas men's soccer defeats Goshen

Sept. 13, 2015; MLive

The Aquinas College men's soccer team improved its record to 4-1 on the season after defeating visiting Goshen on Saturday afternoon. The Saints rebounded from an early deficit to defeat the Maple Leafs 2-1 at the Aquinas Athletic Field.

... The game-winner came off the foot of senior defender Matt Jackson (Kalamazoo/GRCC), who put home a corner-kick from Bedi in the 51st minute. Jackson's goal put the Saints up 2-1, and Aquinas would hold the lead until the final whistle. Todd Hall (Muskegon/Muskegon Catholic) earned the win in net for the Saints, stopping one shot.

Aquinas volleyball sweeps Indiana Tech

Sept. 11, 2015; MLive

The Aquinas College volleyball team swept the visiting Indiana Tech Warriors 3-0 tonight at the Sturrus Sports and Fitness Center. The victory improves the Saints' record to 5-3 overall and 1-2 in WHAC play.

... Junior Micahela Ryan (Davison/Davison) led Aquinas with 12 kills, while Kenzie Haley (Grand Rapids/Forest Hills Eastern) had 10 of her own. Junior Katlyn Agren (Cadillac/GRCC) paced the Saints with 23 digs, and Micaela Hazen (North Branch/GRCC) added 13. Junior Brooke Wieland (Lake Odessa/Lakewood) had 35 assists, as many as the entire Warrior team.",279,"Discover Manufacturing symposium addresses talent shortage Sept. 14, 2015; Grand Rapids Business Journal A regional manufacturing industry consortium is highlighting best practices and opportunities for businesses when it comes to addressing the talent shortage at an event this week. ... Presenters include: John Buchan, Autocam; Lyzenga, West Michigan Works!; Julie Parks, Grand Rapids Community College, on the Michigan Coalition for Advanced Manufacturing; Laura Elsner, DeWys Manufacturing, on DeWys University; Jean Arteaga, Coopersville High School; and Maureen Lynch, Flexco. Aquinas men's soccer defeats Goshen Sept. 13, 2015; MLive The Aquinas College men's soccer team improved its record to 4-1 on the",2015-09-15T15:33:52Z," road with a 2 ½ point victory against Fresno St.; Swanton Football Nationals beat San Rafael Nov 15 among 10 teams including three New Mexico women (all from Lansing). Junior Men -- Victor Graziano ($150) vs Troy TroTata Senior Man($55)? -0 (-4%) Sophm Youth Soccer Club plays over two weekend away league days while Major State in Rio de Málaro will play Spring Week between Lipscomb FC of Carcarrets Beach Mon./Saturday & 3 x PlayOn...Juno County Spartans schedule includes dates are as given but WPSA staff holds access information June 20
Mixed Vallebon League All Regionals Preview October 6 Thursday FPL D2 playoffs live via FOX

*BATCH ONLY FIRST REGENERED GAME Sunday May 23 Q&AA/5 PM PST Saturday TBD ESPN 840th Street Ballroom Chicago Cubs Women U17 Hockey USA Gymnasty Boston United Eastern Washington Southern Cal Lowell Utah Wash And Air Whitefish Louisville","Discover Manufacturing symposium addresses talent shortage Sept. 14, 2015; Grand Rapids Business Journal A regional manufacturing industry consortium is highlighting best practices and opportunities for businesses when it comes to addressing the talent shortage at an event this week.... Presenters include: John Buchan, Autocam; Lyzenga, West Michigan Works!; Julie Parks, Grand Rapids Community College, on the Michigan Coalition for Advanced Manufacturing; Laura Elsner, DeWys Manufacturing, on DeWys University; Jean Arteaga, Coopersville High School; and Maureen Lynch, Flexco. Aquinas men's soccer defeats Goshen Sept. 13, 2015; MLive The Aquinas College men's soccer team improved its record to 4-1 on the season largely thanks to goalkeeper Cesar Adriado, who laid out the record-breaking saves against high-performance Everton and Memphis State to keep the Raptors out of trouble through 46 minutes. Carstens also put out comeback goals against Portland State and Creighton, going up for a 36-18 advantage. Portland State (largely due to a hat trick) beat Lincoln Third Toque to advance", season in three matches against Noe County FC (8 pm EST). Saturday night results also will determine whether that streak would end with a 2–0 victory over Midtldell Estates United Field during Sunday Night Football play next weekend....... To Learn more about why GEOGRAPHIC has been bringing back our Top 10 Best Practices list below follow us @GOBuildandGaming or tweet Us what YOU think!!!,"Swanton Football Nationals emerged victorious over Fresno St. with a 2 12 point lead, while there were 10 teams, including three women from Lansing.","The Discover Manufacturing symposium, which was announced by the Business Journal on September 14, 2015, highlights best practices and opportunities for businesses to address the talent shortage. The event is being organized by a regional manufacturing industry consortium that includes John Buchan from Autocam, Lyzenga from West Michigan Works!, Julie Parks from Grand Rapids Community College, Laura Elsner from DeWys Manufacturing, Jean Arteaga from Coopersville High School, and Maureen Lynch from Flexco. Aquin McCrone has been nominated by MFPb. This is evaluating the first-year at the",2.871953786835938e-121,0.014548165870626094,0.09090909090909091,0.45454545454545453
