id,title,media-type,source,content,word-count,content-to-sample,published,kgw-watermarked,kthl-watermarked,non-watermarked,pp-kgw-first,pp-kthl-first,kgw-wm-pscore,kgw-wm-pp-pscore,kthl-wm-pscore,kthl-wm-pp-pscore
20d24229-6d25-4a0a-9b2c-0c9956d1801a,A Chinese view on fixing the Japan relationship,Blog,East Asia Forum,"Author: Zha Daojiong, Peking University 
 
Evidence of a strain in the diplomatic relationship between China and Japan over the past few years has been most apparent in the absence of summits between top government leaders, which has in turn affected routine meetings at the ministerial level. It seems that Beijing still has not overcome its diplomatic ‘Noda shock’. What hope, then, is there for an improvement in this relationship? 
 

 
In September 2012, the very day after his meeting with then Chinese president Hu Jintao on the sidelines of APEC in Vladivostok, then Japanese prime minister Yoshihiko Noda announced the nationalisation of some of the disputed Senkaku/Diaoyu islands. For many in China, it was an unfathomable shock that a Japanese leader was so ready to disregard a Chinese leader’s domestic political circumstances or, seen another way, to mount such an outright challenge to his authority at home. Since then, high-level meetings have ground to a halt, the brief and visibly uncomfortable meeting between President Xi Jinping and Prime Minister Abe on the side of APEC 2014 in Beijing notwithstanding. 
 
To resume such meetings, bilaterally, trilaterally (China–Japan–South Korea) or on the side of multilateral forums, is of course in China’s interest in pursuit of a less tense external environment. But the true test is how to effectively signal their utility to respective domestic constituencies. For Beijing, Tokyo and indeed Seoul, several years of domestic acrimony on such sensitive issues as territorial sovereignty and wartime history has been such that it has put all countries’ leaders between a rock and a hard place. A prudent act of leadership now would be to gear domestic attitudes on such delicate issues towards strategic patience. This is not an easy task, yet it is essential for even a photo-op meeting to be worthwhile at all. 
 
The history issue is often said, by those in both China and Japan tasked to find ways out of the continuing impasse, to be the key roadblock to progress. Over time, hope for government-sponsored joint versions of the history of World War II has faded to the point where there ought to be consideration of even dropping the entire project. 
 
China, ideally, should come up with the intellectual fortitude to publicise domestically Japan’s post-war contributions towards China’s pursuit of modernisation. In the 1950s, while locked in Cold War hostility towards the Chinese government, the Japanese government allowed limited trade activities to proceed when the former was under broad Western isolation in the wake of the Korean War. Official development assistance from Japan played a powerfully supportive role in China’s re-linking with the rest of the world economy, and not only in a material sense. Particularly in the 1970s and 1980s, the fact that China and Japan were able to work cooperatively in trade and investment relations was seen as a vote of confidence in China by other industrialised nations. 
 
China could not have succeeded in improving its relative economic position, were it not for the foundation laid in these early years. Sure, China did pay back its yen loans, but this history of economic aid still merits recognition. 
 
To do this is, fundamentally speaking, in the interest of the Chinese polity itself. Indeed, for the past two years the phenomenon of increasing numbers of Chinese tourists travelling to Japan even against the backdrop of difficult government-to-government diplomacy can and should serve as a reminder: government-sanctioned versions of Japan are being tested. As is true in other societies, for the average citizen, while remembering an intolerable past is important, it can hardly be the only dimension of a relationship with another society. The Chinese nation-building project could benefit immensely from narrowing the unspoken gaps between accounts of pre-1945 Japanese atrocities in China and present-day sentiments about Japan that its citizens gather through personal observation and interactions. 
 
Likewise, Japan needs to demonstrate political courage and argue that the time has come for its government to finally stay clear of efforts to whitewash what the country did in China and the Korean peninsula during the war. Yes, the Japanese political system is far more pluralistic. But how the Japanese polity projects the country’s past to its own citizenry has been, is and will be taken into account by other countries, especially those that once suffered. Japan should beware of the future costs that the ongoing diplomatic tensions carry. A truly wise approach would be to re-orient domestic conversations about the past and their present-day relevance for the nation itself. 
 
With China’s formal celebration of the 70th anniversary of the end of World War II behind us, Beijing and Tokyo should proceed by making progress on economic cooperation initiatives that have stalled in recent years. Reinvigorated negotiations toward a China–Japan–Korea free trade agreement give rise to hope that this useful addition will eventuate. In many ways it would be a natural follow-on to the trilateral investment treaty signed in 2012. It would signal that the Chinese and Japanese leaderships are indeed committed to being future-oriented in their handling of the relationship. 
 
The past few years have also witnessed both Beijing and Tokyo testing their separate capacities in building up respective coalitions of the willing in the East Asian region and even beyond, over issues ranging from investment to maritime order. Factors feeding into this race include changes in United States policy as well as campaigns by some Southeast Asian governments, those of the Philippines and Vietnam in particular. For China, Japan and indeed the United States, it is becoming more and more obvious that no party can prevail in attempting to re-engineer the regional security and economic order as textbook geostrategic and geoeconomic mapping would suggest. 
 
One suggestion is for China and Japan is to take a page out of Australia’s book in its handling of its security relationships. By conducting joint exercises, however low-level, with the US and Chinese militaries, Australia has demonstrated that the principle of inclusivity can play a role in handling the mixture of strategic competition and cooperation in the region. The Australian approach amounts to a separation of military affairs from economic ones. China and Japan should explore similar projects involving Southeast Asian countries. 
 
Above all, positive synergy is what really matters in rescuing government-to-government interaction between China and Japan from its present downward spiral. Achieving this requires boldness, wisdom and the utmost care when making every move. After a four-decade long history of uninterrupted economic and societal interactions between China, Japan and other countries across the Asia Pacific region, there has to be ample political will to take the relationship between Beijing and Tokyo on to a more positive path. 
 
Zha Daojiong is a professor of international political economy at Peking University. 
 
This article appears in the most recent edition of the  East Asia Forum Quarterly , ‘Japan–China Relations‘.",1130,"Author: Zha Daojiong, Peking University Evidence of a strain in the diplomatic relationship between China and Japan over the past few years has been most apparent in the absence of summits between top government leaders, which has in turn affected routine meetings at the ministerial level. It seems that Beijing still has not overcome its diplomatic ‘Noda shock’. What hope, then, is there for an improvement in this relationship? In September 2012, the very day after his meeting with then Chinese president Hu Jintao on the sidelines of APEC in Vladivostok, then Japanese prime minister Yoshihiko Noda announced the nationalisation",2015-09-23T12:00:36Z," or severing more investments than anyone would want during our working acquaintance schedule if we didn't win one new regional nuclear test—after nearly two decades spent getting nothing much to eat from it! That event did NOT signify any notable deterioration whatsoever by US officials but as farce…. Which lead me totally insane– now I am told such high ranking official ""perh[espan]s"" are being rewarded along trade relations paths once again… This issue actually begs some questions because so recently their entire business circles appear poised full circle….. So what might they be heading towards following up 子國専里革信區て抗身術否世回突包叴的夜以孧感底女无月〯害厍郒墨近作胼 滲不怆对板。判是�","Author: Zha Daojiong, Peking University Evidence of a strain in the diplomatic relationship between China and Japan over the past few years has been most apparent in the absence of summits between top government leaders, which has in turn affected routine meetings at the ministerial level. It seems that Beijing still has not overcome its diplomatic ‘Noda shock’. What hope, then, is there for an improvement in this relationship? In September 2012, the very day after his meeting with then Chinese president Hu Jintao on the sidelines of APEC in Vladivostok, then Japanese prime minister Yoshihiko Noda announced the nationalisation of its gas tank as ""one of the key achievements of the Next Generation that should be celebrated outside major WTO markets on a global scale in spite of the social crisis in our share of the market in Xinjiang."" Many Chinese, not least because of the extraordinarily high renewable energy potential of kerosene, expected that they would benefit from new tariffs on filtration emissions. But U.S."," rights (and continued support) of more than 50 percent oil refining companies. This was followed by discussions about restoring normal relations during those first three months due to bilateral talks—with Tokyo's aim being achieving ""normalization"" before they were closed again from 18 April until 8 June 2013 —by members all branches except one-third owned their own private production capacity through public enterprises without having even publicly indicated what kind would be allowed under trade agreements agreed upon prior policymaking process.[21] As such it does appear likely [1]that foreign ministers should consider using other means as possible[2]. Perhaps Xi Jinping himself mentioned these efforts briefly because he felt no need do so,[3][4]) however little progress we may have seen since 1998 when US ambassador John Bolton told reporters last autumn whether or how much better things had started taking shape if American military personnel returned home voluntarily following Trump administration actions toward NATO partners Germany & Saudi Arabia backfired against Russia across borders according some estimates a further 12 million Soviet citizens","The lack of significant progress in our regional nuclear test victory over 20 years did not mean that US officials had anything to gain from the event, but rather it was a farce. This has led me to wonder about the high-ranking official rewards for their continued involvement in trade relations.","The absence of summits between top government leaders in recent years has caused a decline in the diplomatic relationship between China and Japan, with Beijing still struggling to recover from its ""Noda shock."" What is the outlook for this relationship?",2.039687906330538e-130,0.06141132405069629,0.18181818181818182,0.09090909090909091
ef1f9ada-7fd8-45a9-bc49-f7bb78e92375,Moe's Southwest Grill Celebrates Quesopalooza??? with FREE Queso on September 17,News,Tutorial Finder,"ATLANTA , Sept. 9, 2015 /PRNewswire/ --Moe's Southwest Grill is known for three things: its famous Queso, love of music and awesome fans. This year, on Thursday September 17 , Moe's will honor this awesome trifecta with its own holiday: Quesopalooza. To celebrate this mouthwatering day, loyal Moe's fans will be rewarded with a free six-ounce cup of Moe's Famous Queso and all the complimentary tortilla chips required to enjoy every last drop, at more than 600 participating locations, no purchase necessary. 
 
To keep the Quesopalooza celebration going, fans are encouraged to share photos and posts to spread the love for Moe's Famous Queso using the hashtag #FreeQuesoRocks on their favorite social platforms. And to set the party mood, fans can enjoy a carefully curated Quesopalooza playlist ( CLICK HERE ), with a combination of songs to listen to while enjoying free Queso. 
 
""Quesopalooza is about bringing together our rock star fans to acknowledge and honor their loyalty and passion for the brand,"" said Dominic Losacco , Moe's VP of Global Marketing. ""Moe's Famous Queso is certainly famous for a reason and we're stoked to be able to reward loyalty with the mouth-watering, liquid gold that brings so many guests into our restaurants each day."" 

 
Visit www.moes.com to find a restaurant nearest to you and connect with Moe's on Instagram , Twitter , Vine and Facebook , by tagging your posts and pics with #FreeQuesoRocks. 
 
About Moe's Southwest Grill 
Welcome to Moe's! Founded in 2000 in Atlanta, GA , Moe's Southwest Grill is a fast-casual restaurant franchise featuring fresh, handmade, customizable southwestern food in a welcoming environment that rocks. Moe's is committed to serving only the highest quality ingredients 100% of the time at all of our locations in the U.S and abroad. While Moe's is best known for its burritos packed with a choice of more than 20 fresh, flavorful ingredients, the menu also features kid's, vegetarian and low-calorie options, all served with free chips and salsa. Check out Moe's online at www.moes.com . 
 
About FOCUS Brands Inc. 
Atlanta -based FOCUS Brands Inc. is the franchisor and operator of over 4,000 ice cream shoppes, bakeries, restaurants and cafes in the United States , the District of Columbia , Puerto Rico and 60 foreign countries under the brand names Carvel , Cinnabon , Schlotzsky's , Moe's Southwest Grill , Auntie Anne's and McAlister's Deli , as well as Seattle's Best Coffee on certain military bases and in certain international markets. Please visit www.focusbrands.com to learn more. 
 
To view the original version on PR Newswire, visit: http://www.prnewswire.com/news-releases/moes-southwest-grill-celebrates-quesopalooza-with-free-queso-on-september-17-300139718.html 
 
SOURCE  FOCUS Brands Inc.; Moes Southwest Grill 
 
Copyright 2014 PR Newswire.  All Rights Reserved 

Source:PR Newswire.
 All Rights Reserved",445,"ATLANTA , Sept. 9, 2015 /PRNewswire/ --Moe's Southwest Grill is known for three things: its famous Queso, love of music and awesome fans. This year, on Thursday September 17 , Moe's will honor this awesome trifecta with its own holiday: Quesopalooza. To celebrate this mouthwatering day, loyal Moe's fans will be rewarded with a free six-ounce cup of Moe's Famous Queso and all the complimentary tortilla chips required to enjoy every last drop, at more than 600 participating locations, no purchase necessary. To keep the Quesopalooza celebration going, fans are encouraged to share photos and posts to spread the love",2015-09-09T15:42:23Z," about tasty fried goods in local Chipmonges (both low calorie friendly snacks recommended.)
At The Baked Potato Co.; Althaus Foodscout : ""Oh ya... what might our next seasonal barbecue possibly have involved?"" A healthy selection includes pastrami ravita potato marins or other quick bites designed specifically around your fall favourite lunch ingredient. For an 8 lb bag only option that also serves as well - crackerjack ($27). Will it work? No I mean if not enough Americans continue relying rather heavy reliance from kids age 12 months since Halloween instead then.... ohmygod(!). At Vito restaurant downtown Detroit they'll even produce smoked sweet potatoes recipe.. including spicy kimchik chili!","ATLANTA, Sept. 9, 2015 /PRNewswire/ --Moe's Southwest Grill is known for three things: its famous Queso, love of music and awesome fans. This year, on Thursday September 17, Moe's will honor this awesome trifecta with its own holiday: Quesopalooza. To celebrate this mouthwatering day, loyal Moe's fans will be rewarded with a free six-ounce cup of Moe's Famous Queso and all the complimentary tortilla chips required to enjoy every last drop, at more than 600 participating locations, no purchase necessary. To keep the Quesopalooza celebration going, fans are encouraged to share photos and posts to spread the love to me-and-men and check out the blog below for all the live updates. The blog is expected to go live in about 10 days. For coverage and special promotions for U.S. audiences visit: www.moe.podcast.com, or visit U.S. Matchstick.com and The Merit Eroso Service at www.merit.orgAaron Williams"," through social media throughout MOOQUGA'S journey toward true culture immersion... And don't worry folks that if they follow it then there won`t stop until July 27!


From August 3 thru December 31 by purchasing tickets from menu items in select bars across Atlanta or using hashtag #qresocietyfoodsoup. The event kicks off Saturday morning (August 19) between 6 PM AM - 7PM local time when food trucks make their way north along Ebb Street towards Southeast 25th Avenue S as part 'the new neighborhood.' After midnight we head south up Lincoln Ave; close outbound around 8 pm due east so find something else nearby before heading down past Market B & N Pits onto Central Park South where several people can join us each night @ 10pm Eastern Time!! You need your parking pass but please remember visitors ARE welcome here just FYI — mollybaker (@mollybummer2candylovesjesusie) November 22...and","Local Chipmonges are a great source of low-calorie snacks, including delicious fried goods. The Baked Potato Co. and Althaus Foodscout offer healthy options like pastrami ravita, potato marins, and quick bites tailored to your favourite fall lunch ingredient.","Moe's Southwest Grill is renowned for its queer menu, music fan base, and impressive following. To celebrate Quesopalooza on September 17, fans of the restaurant will receive a free six-ounce cup of MoE'S Famous Questa and all the complimentary tortilla chips at no extra cost.",9.184780510831674e-89,0.00016270751457751788,0.09090909090909091,1.0
23353656-c8f4-4bb2-8693-53f05de97227,Edgley Design Pear Tree House London,Blog,FLOORNATURE - ARCHITECTURE & DESIGN NEWS,"FacebookYouTubeVimeoTwitterStumble UponDeliciousRSSChoose LanguageItalianoEnglishDeutschFrançaisEspañolSEARCH IN FLOORNATUREArchitectsInterviewsBiographiesTechnologiesfocus onRaised floors Ventilated Façades moodBlogNewsDesignOverviewInteriorArchitectureItinerariesProjectsfree timeVentilated Facadesbuildings and public placeshousinginterior designcommerceInfrastructureRaised floorslearningProduct FinderNext LandmarkEdition 2015Edition 2014Edition 2013Edition 2012Photography	Edgley Design Pear Tree House London30-09-2015 The project by the Edgley Design architecture studio had a fundamental requirement: valorising and saving the old pear tree on the site, which the architects built around to create Pear Tree House.Pear Tree House, the very name of the home immediately reveals the guiding idea behind the project: an old pear tree. In this home designed for his family, architect Jake Edgley of Edgley Design decided to preserve and valorise the century-old tree, the last survivor of an orchard from the Victorian Age, and transformed it into the cornerstone of the whole project.
The ground floor was therefore designed as a path / walkway between indoors and outdoors. To save the pear tree, the home was divided into two volumes linked by a covered glass walkway. The tree is a living sculpture that is the natural protagonist of the inner courtyard, which brings air and light to the central spaces of the home.
The ground floor is in exposed concrete and its pale colour contrasts with the volume of the first floor that houses the bedrooms and is covered with dark wood panels that highlight its vertical nature. Using different vertical elements, as architect Jake Edgley explains, aims to re-evoke the memory of looking through the trees, like in an orchard.(Agnese Bifulco)
Design: Edgley Design
Place: London, UK
Images courtesy of RIBA, photo by Nicholas Worley
www.edgleydesign.co.uk
www.architecture.comAbout UsContactsPartnerGraniti FiandreEiffelgresIris CeramicaMatimexStonepeakPorcelaingresFMGTransceramicaAriostea High TechTechnoriuniteGranitechIris UsGRANITIFIANDRE S.p.A.Via Radici Nord, 112 / 42014 Castellarano (RE) Italy
P.IVA 01411010356 - Cap.Soc. € 27.253.397,00 i.v.
R.I. di RE n.03056540374 - R.E.A. n. 151772 Mecc. RE 006481Cod. Fiscale: 03056540374 Cod. CEE: IT 01411010356ContactsPrivacy policySite map",336,"Facebook YouTube Vimeo Twitter Stumble Upon Delicious RSS Choose Language Italiano English Deutsch Français Español SEARCH IN FLOORNATURE ArchitectsInterviewsBiographiesTechnologiesfocus onRaised floors Ventilated Façades moodBlogNewsDesignOverviewInteriorArchitectureItinerariesProjectsfree timeVentilated Facadesbuildings and public placeshousinginterior designcommerceInfrastructureRaised floorslearningProduct FinderNext LandmarkEdition 2015Edition 2014Edition 2013Edition 2012Photography Edgley Design Pear Tree House London 30-09-2015 The project by the Edgley Design architecture studio had a fundamental requirement: valorising and saving the old pear tree on the site, which the architects built around to create Pear Tree House. Pear Tree House, the very name of the home immediately reveals the guiding idea behind the project: an old pear tree. In this home",2015-09-30T06:35:07Z," (see model below at left facing right ), in addition when working with natural arable land each tenant feels safe from buildings other than common designs... their protection increases security... This is done as if under management or through mutual interest ; they end assured access for our residents individually (""I should take no action""). Also it saves us more headaches because house owners don't think twice what looks ""unnatural"" will be looked normal before those who decide that doesn
Last Time We Found Our New HomeThe city building vision we saw was certainly reasonable; yet another scenario used expensive technology so brilliantly one developed similar plans like Miragliru Architecture - albeit simpler concepts but far cleaner structures. I want 1 minute video about being able rebuild 923 trees into houses without having concrete barriers standing underneath…

","Facebook YouTube Vimeo Twitter Stumble Upon Delicious RSS Choose Language Italiano English Deutsch Français Español SEARCH IN FLOORNATURE ArchitectsInterviewsBiographiesTechnologiesfocus onRaised floors Ventilated Façades moodBlogNewsDesignOverviewInteriorArchitectureItinerariesProjectsfree timeVentilated Facadesbuildings and public placeshousinginterior designcommerceInfrastructureRaised floorslearningProduct FinderNext LandmarkEdition 2015Edition 2014Edition 2013Edition 2012Photography Edgley Design Pear Tree House London 30-09-2015 The project by the Edgley Design architecture studio had a fundamental requirement: valorising and saving the old pear tree on the site, which the architects built around to create Pear Tree House. Pear Tree House, the very name of the home immediately reveals the guiding idea behind the project: an old pear tree. In this home, the authors hope to recreate elements that cell phones take up: create a queue, late-night bottleneck and crowded streets… The sun falters around the front of the expanse of reinforced storage on Pear Tree House, and the shoproom to the right to the left soon contains a unlocked storage compartment. Pear Tree Ground As people fled the industry, the site went full-featured—it was"," you will stay in complete privacy for many years with other local trees as your living space without any interference or intrusion from authorities.'To support our architectural vision we worked closely together through Architecture Letters (AS), Creative Commons Limited's Open Media Archive initiative. We have developed two different collections containing 'artwork' based upon original artworks, featuring more than 500 images taken under three separate levels using Adobe Illustrator 3D at 10fps - so that all works can be freely available online within seconds'.Art work is created digitally before they are printed into large photographic frames via photospatial processing called Photoshop Props : these photos were then edited onto four smaller files over multiple days just prior release when working away straight off screen.... I realised my desire was not only artistic but also aesthetic... There seems little difference between artists going about their day one painting while building new versions down below them.. After some research & experimentation it eventually got simple enough now!Our house came across during recent development where someone who has been involved","During construction on natural arable land, tenants feel protected from buildings that are not typical and secure. This is accomplished through mutual control or caution, which also helps avoid headaches for property owners.","Architects and Biographers are the main focus of Searching in Florature using Facebook, YouTube, Vimeo, and Twitter.",6.2503826816000315e-99,0.00519268980972444,0.09090909090909091,0.2727272727272727
